Location,Name,Description,FileName,SourceName,SourceUrl
Thailand,Royal Pavilion in Phraya Nakhon Cave,"Royal pavilion in Phraya Nakhon Cave in Khao Sam Roi Yot National Park, Prachuap Khiri Khan province, Thailand.",Thailand-Royal-Pavilion-in-Phraya-Nakhon-Cave.jpg,Wikipedia,https://en.wikipedia.org/wiki/File:01-%E0%B8%9E%E0%B8%A3%E0%B8%B0%E0%B8%97%E0%B8%B5%E0%B9%88%E0%B8%99%E0%B8%B1%E0%B9%88%E0%B8%87%E0%B8%84%E0%B8%B9%E0%B8%AB%E0%B8%B2%E0%B8%84%E0%B8%A4%E0%B8%AB%E0%B8%B2%E0%B8%AA%E0%B8%99%E0%B9%8C.jpg
Slovakia,Lietava Castle,"Lietava Castle (Slovakia).",Slovakia-Lietava-Castle.jpg,Wikipedia,https://en.wikipedia.org/wiki/File:Lietavsk%C3%BD_hrad-v%C3%BDchodn%C3%A1_strana.jpg
America,The Maroon Bells in Aspen,"The Maroon Bells in Aspen, Colorado, with Maroon Lake in the foreground.",America-The-Maroon-Bells-in-Aspen.jpg,Wikipedia,https://en.wikipedia.org/wiki/File:Maroon_Bells_(11553)a.jpg
South Georgia,Shag Rocks,"Shag Rocks, South Georgia.",South-Georgia-Shag-Rocks.jpg,Wikipedia,https://en.wikipedia.org/wiki/File:SGI-2016-South_Georgia%E2%80%93Shag_Rocks_01.jpg
Antarctic,Arena Glacier Hope Bay Trinity Peninsula,"Arena Glacier, Hope Bay, Trinity Peninsula, on the northernmost tip of the Antarctic Peninsula (Photo taken from a moving zodiac).",Antarctic-Arena-Glacier-Hope-Bay-Trinity-Peninsula.jpg,Wikipedia,https://en.wikipedia.org/wiki/File:Hope_Bay-2016-Trinity_Peninsula%E2%80%93Arena_Glacier_01.jpg
Argentina,Valle Carbajal,"Aerial view of Valle Carbajal (terminus) in the Southern Andes, Tierra del Fuego Province, Argentina (Fuegian Andes within a 12 miles radius of Ushuaia)",Argentina-Valle-Carbajal.jpg,Wikipedia,https://en.wikipedia.org/wiki/File:ARG-2016-Aerial-Tierra_del_Fuego_(Ushuaia)%E2%80%93Valle_Carbajal_01.jpg
Estonia,Tarvasjõgi at Kõrvemaa Nature Park,"Tarvasjõgi at Kõrvemaa Nature Park in Estonia.",Estonia-Tarvasjogi-at-Korvemaa-Nature-Park.jpg,Wikipedia,https://en.wikipedia.org/wiki/File:Tarvasj%C3%B5gi.jpg
India,Pahalgam Valley,"View of the Pahalgam Valley.",India-View-of-Pahalgam-Valley.jpg,Wikipedia,https://en.wikipedia.org/wiki/Pahalgam
France,Cirque de Gavarnie Haute-Pyrénées,"Cirque de Gavarnie, Haute-Pyrénées, France.",France-Cirque-de-Gavarnie.jpg,Wikipedia,https://en.wikipedia.org/wiki/File:Cirque_de_Gavarnie%2C_Haute-Pyr%C3%A9n%C3%A9es%2C_France.jpg
Indonesia,Beach west of Karang Bolong,"Beach west of Karang Bolong, Nusakambangan, Cilacap 2015-03-21 (may be considered part of Karang Bolong beach).",Indonesia-Beach-west-of-Karang-Bolong.jpg,Wikipedia,https://en.wikipedia.org/wiki/File:West_end_of_Karang_Bolong%2C_Nusakembangan%2C_Cilacap_2015-03-21.jpg
